"","dates","titles","contents","push","id"
"80","Sun Jun  4 00:21:11 2017","Re: [問卦] 基隆真的存在嗎？",": 基隆明明在北部 : 但對住在台北的小弟我 : 卻十分陌生 : 大學完全沒聽過有人是從基隆來的 : 在我的觀念裡 : 去基隆要坐豪久的客運 : 或坐豪久的火車 : 彷彿是化外之地 : 所以 : 基隆到底是什麼樣的存在呢？ : 會不會其實是另一葛次元 : 或另一葛時空才存在的國度呢？ : 下次搭去基隆的客運 : 是要穿過一道白光才到得了基隆嗎？ 雖然可能多數人是抱著看笑話的心態來酸基隆這個地方， 但身為一個基隆人實在是無法略過這篇文章， 我自認是個還滿有自覺的基隆人， 台灣史中基隆佔了滿重要的位置， 在歷史課本上滿常看到基隆這個詞的，荷西時期、清領時期、日治時期 如果可以的話，可以聽聽這個悲情城市的故事。 基隆是個沒落很久的地方， 日治時期時是台灣數一數二繁榮的城市， 因為鄰近日本，又能夠藉著船運入港一些舶來品，造就了當年許多的委託行、報關行， 當時的基隆有全台最新奇的東西，說這就是最早的代購也不為過吧 以及有許多美軍的船會在基隆停靠， 也讓基隆像個不夜城一般，當年有許多酒吧， 基隆很著名的鬼屋林開群洋樓據說也跟這類故事有關， 但也不可考啦，也有一說只是產權不清，所以荒廢變鬼屋。 但日治時期結束後，國民政府來台， 原以為還能維持一貫的繁榮， 除了當年從國民軍從基隆登台的落魄景象， 以及二二八事件時，三月八號從基隆港登台增援的軍隊造成的屠殺， 讓許多基隆的仕紳從此消失，也讓基隆人從此噤聲，變成鐵藍票倉， 二二八事件對基隆而言，其實是三零八基隆大屠殺。 所以，基隆這個地方大部分時間都是藍營執政， 國民黨也一直抱持著反正躺著選也會上的心態， 基隆就是個被遺棄的乖孩子。 我今年22歲，五歲搬來基隆至今， 可以說對我而言前十幾年基隆就像是時間靜止了一樣，毫無改變， 考高中時我也覺得我一定要離開這個破舊的城市， 但漸漸長大了，也真的如願到台北唸書了，才開始回頭看看這個孕育我的故鄉，瞭解它的 歷史、瞭解他的故事。 然後，認真地想去改變他、幫助他。 在我大一時前市長終於要卸任之際，爆出一連串荒腔走板的新聞，當時覺得，可惡我一定 要改善這個狀況， 選現任市長時，別的候選人是當時的議長，爆出貪污的醜聞，我也覺得，不能讓基隆再這 樣下去了， 還好，我們真的透過選票讓改變成真了。 基隆真的停滯太久了，要跟上其他進步的城市還有些困難。 但我們正在努力，除了政府外，民間也有許多單位開始正視這件事。 大家也都想為這塊地方發展出自己的故事，以及找回往日的繁榮。 其實，基隆很近， 但就是因為離首都那麼近，時常被忽視， 到東區搭客運只要三十分鐘，到台北車站搭客運只要四十分鐘， 內湖、士林、大直、南京東路、市府大部分台北市的地方基隆都能夠直達， 所以捷運沒有我們的份，高鐵也沒有我們的份，反正轉乘很快嘛...... 有人說道地的基隆人就是自備轉乘通，這句話很符合基隆人沒錯。 而基隆市內的公車除了有些還很老舊外，其實非常發達，應該除了雙北、台中、高雄外， 公車能這麼便利的城市很少。 雖然目前基隆還沒發展起來， 但他曾經繁榮過，也留下許多有趣的事， 如果有空，不妨來基隆走走， 外木山、大武崙沙灘、八斗子、和平島， 最近也出了個北部最美車站在基隆哦，八斗子車站真的景色非常美， 也能到潮境公園、望幽谷走走， 不想到海邊的話，其實基隆也有滿多條螢火蟲步道， 最近我和朋友才要抽空去逛逛、攝影呢 如果想要到新北的金山、萬里、瑞芳、九份、平溪、猴狪、十分走走， 基隆的客運、火車轉乘也非常方便。 提到基隆當然不能錯過的美食部分， 其實基隆的美食能量跟密集度不輸台南， 但餐廳的精緻度當然無法跟台北比啦。 大多數人都只知道廟口，雖然廟口也夠好吃了， 基隆是個食物平均值滿高的地方， 隨便的路邊攤也好吃，我家住八斗子附近，離市區有段距離， 但我家樓下的東西我覺得已經贏過台北滿多攤子了， 順帶一提，我住過台北的饒河夜市及士林，以這兩個地方來比較。 我也沒有聽過基隆人自稱自己是台北人的啦， 反倒前陣子我才問新北人為何都要自稱自己台北人，然後對方就生氣了...... 文章有點長，不過真的是因為瞭解了過後，才更期待這個地方的復甦。 最後，我是基隆人， 也非常以自己的名字為傲。 標 時間: Sun Jun 4 00:21:11 2017 : 基隆明明在北部 : 但對住在台北的小弟我 : 卻十分陌生 : 大學完全沒聽過有人是從基隆來的 : 在我的觀念裡 : 去基隆要坐豪久的客運 : 或坐豪久的火車 : 彷彿是化外之地 : 所以 : 基隆到底是什麼樣的存在呢？ : 會不會其實是另一葛次元 : 或另一葛時空才存在的國度呢？ : 下次搭去基隆的客運 : 是要穿過一道白光才到得了基隆嗎？ 雖然可能多數人是抱著看笑話的心態來酸基隆這個地方， 但身為一個基隆人實在是無法略過這篇文章， 我自認是個還滿有自覺的基隆人， 也或多或少知道基隆的歷史， 如果可以的話，可以聽聽這個悲情城市的故事。 基隆是個沒落很久的地方， 日治時期時是台灣數一數二繁榮的城市， 因為鄰近日本，又能夠藉著船運入港一些舶來品，造就了當年許多的委託行、報關行， 當時的基隆有全台最新奇的東西，說這就是最早的代購也不為過吧 以及有許多美軍的船會在基隆停靠， 也讓基隆像個不夜城一般，當年有許多酒吧， 基隆很著名的鬼屋林開群洋樓據說也跟這類故事有關， 但也不可考啦，也有一說只是產權不清，所以荒廢變鬼屋。 但日治時期結束後，國民政府來台， 原以為還能維持一貫的繁榮， 除了當年從國民軍從基隆登台的落魄景象， 以及二二八事件時，三月八號從基隆港當台增援的軍隊造成的屠殺， 讓許多基隆的仕紳從此消失，也讓基隆人從此噤聲， 乖乖聽話，變成鐵藍票倉， 二二八事件對基隆而言，其實是三零八基隆大屠殺。 所以，基隆這個地方大部分時間都是藍營執政， 國民黨也一直抱持著反正躺著選也會上的心態， 我今年22歲，五歲搬來基隆至今， 可以說對我而言前十幾年基隆就像是時間靜止了一樣，毫無改變， 考高中時我也覺得我一定要離開這個破舊的城市， 但漸漸長大了，也真的如願到台北唸書了，才開始回頭看看這個孕育我的故鄉，瞭解它的 歷史、瞭解他的故事。 然後，認真地想去改變他、幫助他。 在我大一時前市長終於要卸任之際，爆出一連串荒腔走板的新聞，當時覺得，可惡我一定 要改善這個狀況， 選現任市長時，別的候選人是當時的議長，爆出貪污的醜聞，我也覺得，不能讓基隆再這 樣下去了， 還好，我們真的透過選票讓改變成真了。 基隆真的停滯太久了，要跟上其他進步的城市還有些困難。 但我們正在努力，除了政府外，民間也有許多單位開始正視這件事。 大家也都想為這塊地方發展出自己的故事，以及找回往日的繁榮。 其實，基隆很近， 但就是因為離首都那麼近，時常被忽視， 到東區搭客運只要三十分鐘，到台北車站搭客運只要四十分鐘， 內湖、士林、大直、南京東路、市府大部分台北市的地方基隆都能夠直達， 有人說道地的基隆人就是自備轉乘通，這句話很符合基隆人沒錯。 而基隆市內的公車除了有些還很老舊外，其實非常發達，應該除了雙北、台中、高雄外， 公車能這麼便利的城市很少。 雖然目前基隆還沒發展起來， 但他曾經繁榮過，也留下許多有趣的事， 如果有空，不妨來基隆走走， 外木山、大武崙沙灘、八斗子、和平島， 最近也出了個北部最美車站在基隆哦，八斗子車站真的景色非常美， 也能到潮境公園、望幽谷走走， 不想到海邊的話，其實基隆也有滿多條螢火蟲步道， 最近我和朋友才要抽空去逛逛、攝影呢 如果想要到新北的金山、萬里、瑞芳、九份、平溪、猴狪、十分走走， 基隆的客運、火車轉乘也非常方便。 提到基隆當然不能錯過的美食部分， 其實基隆的美食能量跟密集度不輸台南， 但餐廳的精緻度當然無法跟台北比啦。 大多數人都只知道廟口，雖然廟口也夠好吃了， 基隆是個食物平均值滿高的地方， 隨便的路邊攤也好吃，我家住八斗子附近，離市區有段距離， 但我家樓下的東西我覺得已經贏過台北滿多攤子了， 順帶一提，我住過台北的饒河夜市及士林，以這兩個地方來比較。 我也沒有聽過基隆人自稱自己是台北人的啦， 反倒前陣子我才問新北人為何都要自稱自己台北人，然後對方就生氣了...... 文章有點長，不過真的是因為瞭解了過後，才更期待這個地方的復甦。 最後，我是基隆人， 也非常以自己的名字為傲。 那攤我有吃過 我也覺得，不過這幾年來有漸漸在換新的了，可能還沒有經費換完吧...... 最近瞭解二二八事件中八堵車站的故事覺得QQ 你是不是很久沒來基隆 田寮河跟海洋廣場已經不臭很久了， 現在河道旁還建了草皮，超多人遛狗，也有很多小孩在爬海洋廣場的假礁石...... 是說許梓桑嗎?前陣子才有舉辦許梓桑祭~ 我好像發現文章跟有些推噓文重複了， 但不是我自己複製的，我也不敢亂刪......QQ 我也有聽過為了要搶九份還哪裡跟瑞芳決戰的故事哈哈哈 到台北車站的客運會停忠孝新生嘛QQ 之前夏天看到超多黑鳶盤旋， 然後海洋廣場上一堆攝影師超酷的 沒啊我文章不是說前幾年已經藍天變綠地了 HarunaOno :轉錄至看板 Keelung 06/04 08:04 撿客文化還是在哦 但剩幾條公車班次比較少的路線 我是以方便性來稱讚的 我有經歷過呀，應該是我高中時期的事吧 但都改那麼久也遲早該改口了吧....... 我也沒有再聽過高雄人自稱來自打狗， 基隆的和平島人稱自己來自聖薩爾瓦多城啊...... 如果以前身這個論點來看的話。 不會啦台中公車很發達，台灣大道上很方便",321,"M.1496506873.A.041"
"81","Sun Jun  4 00:47:39 2017","[爆卦] 今天是中國民主倒退的一天","28年前的今天 六四天安門事件 中國民主最後希望的一群人 被中國用59坦克壓過去 人民也被軍人無差別掃射 死傷慘重 至今 中國仍然想要隱瞞這件事 也凸顯了中國共產野蠻不道德的真實面 身為民主國家中的人民 為對國這種行為感到悲哀 由此可見 中國是一個可憐又資訊封閉的低能國家 人民也是井底之蛙 可憐啊 http://i.imgur.com/lobeHC8.jpg 以下每十推 支那賤畜六四天安門快樂 稅後100p 發到我沒錢 1 2 3 4 64樓 5 6 7 8 9 10 11 12 13 14 15 16 17 18 19 20 21 22 23 24",652,"M.1496508461.A.99A"
"82","Sun Jun  4 01:32:20 2017","Re: [問卦] 有反核人士認為火力發電很乾淨的卦？","反核真的整天在那邊跳不停的 鬼都知道核電廠有爆炸機率，你他媽只要走出門也就有被車撞死的機率 ，所以你就從此不出門？(被車撞這機率應該比核電廠爆炸還高） 預算編了蓋了，在合理的風險下你就用，你他媽的好好能用的不用，在 那邊封廠，整天讓火力發電廠超載發爐，中南部人光吸廢氣幾十年肺癌 累積死的人大概都超過核電廠炸一座的死亡數了 替代能源、綠能，以後能發展起來當然好啊。但現在明顯就是這些還無 法應付，就只能火力發電廠發爐讓PM2.5爆表，結果反核智障整天在那 邊作夢只要乾淨能源。等你乾淨能源夠便宜夠用再來說嘴啦 ",101,"M.1496511143.A.666"
"83","Sun Jun  4 02:40:52 2017","[問卦] 一篇文章幾推算是有不錯的人氣回響？","撇除八卦發錢文必爆 一篇優質的回文或是能夠引起大家共鳴的討論或問卦文 大概要幾推算是有引起回響的那種？ 我個人覺得30推以上就不錯了說(<U+3065>ω）<U+3065> 正 >< 好啦 如果這篇超過60推 每15推100p 發到爆 wuyiulin : 黃色就可以了 06/04 02:50 因為你是唯一一位有回答我問題的人 所以加碼 推 mi324 : 推 06/04 02:51 推 Shushusnail : 推 06/04 02:57 因為指考生很窮 這樣可以節省成本 推 pote85712 : 蓋 06/04 03:01 推 pote85712 : 蓋 06/04 03:03 欸為啥你可以推這麼多 都不用CD嗎 13推都你的 推 oxxoooo : 06/04 03:06 推 smill2266 : 推 06/04 03:10 推 coolericliu : ok 06/04 03:11 推 Oceanpeter : 推 06/04 03:13 推 charles269 : 64推 06/04 03:19 你第115推，雖然是時事梗 姑且算你有回答我的問題 加碼 OK我明天用電腦的時候發",157,"M.1496515254.A.6E6"
"84","Sun Jun  4 04:36:05 2017","[爆卦] 2017歐冠冠軍皇馬","恭喜皇馬獲得2017歐冠冠軍 4比1奪冠 C羅2球 Asensio 1球 Casimiro 1球 其實我是拜仁球迷... ",103,"M.1496522167.A.FEB"
"85","Sun Jun  4 06:46:55 2017","[爆卦] 英國倫敦發生恐怖攻擊","時間約是一小時前 在英國倫敦橋上有人開車衝撞人行道 輾過六人 20人受傷 車子停下後有三人跳下車拿刀砍人 目擊者表示看到有人被割喉 另外在附近著名人潮聚集處BOROUGH MARKET 剛剛也傳出槍聲 附近當時有人在酒吧 拍到警察衝進來 叫大家趴下的畫面 https://twitter.com/bayramzilan/status/871135150356221952 雖然是歐洲日常但還是 Pray for London. 更新：疑似第三處恐攻剛發生在離橋約45km的vauxhall 區 ",159,"M.1496530019.A.2E2"
"86","Sun Jun  4 08:02:11 2017","[問卦] 遊覽車歐吉桑卡拉OK，該唱什麼輾壓全場","如題 今天里內旅遊 遊覽車上歐吉桑解放狂唱 但是有些實在是難聽到想揍人 那麼 各位覺得小弟該唱什麼歌讓他們閉嘴呢？ 有沒有八卦？？ 南投ㄉ樣子，6點就出發惹 應該有ㄅ，因為司機也爽到跟著唱 有ㄚ，好像現在都規定要播惹？",150,"M.1496534537.A.420"
"87","Sun Jun  4 08:12:07 2017","[問卦] 為什麼恐怖分子都不會在中國犯案?","每次恐怖分子都去英國或法國等歐洲大國犯案 中國也是世界上的大國， 聯合國常任理事國之一， 怎麼都沒聽過 ISIS 敢去中國犯案? 有沒有八卦? ",140,"M.1496535130.A.BDD"
"88","Sun Jun  4 08:22:15 2017","[新聞] 醫師不在場護理師接生？產婦PO文惹議","醫師不在場護理師接生？產婦PO文惹議 （中央社網站3日電）陣痛醫院不收、醫生不在，產胎盤、縫傷口全由台大醫院護理師一 手包辦，我只能怪這個小孩沒有醫生緣？一位產婦在PTT貼文感嘆，同時感謝台大護 理師群，意外引起討論，其實整件事誤會大了。 一位媽媽在PTT媽寶（BabyMother）版po出一篇沒有醫生在場的生產感謝台大護理師 群文章，細細訴說她生第二胎時的奇遇，包括規律宮縮和陣痛，一再被醫院退貨 ，讓產婦痛到寸步難行；開始生的時候，痛到她失控地鬼吼鬼叫，最後再由護理師一手包 辦縫合、產胎盤等工作。 這位媽媽不斷感謝台大護理師的溫柔和細心，但她的家人不免抱怨怎麼生小孩沒有醫生在 ，我只能怪這個小孩沒有醫生緣？ 這篇文引發網友討論，有人說台大沒有任何一個護理師會縫合傷口，可能是女住院醫師 讓妳誤會囉、大家穿著刀服不好分辨出誰是誰、網友還說，沒有醫師在場的生 產是很嚴重的指控，護理師縫合違反醫療法。 媽媽回文說：我想住院醫師真的沒有在場喔因為事後巡房她還有跟我道歉，沒想 到這位台大婦產科住院醫師親自跳出來回文。 黃醫師說，自己原本預定當天清晨要幫忙接生，但剛好碰到家中2個月大的寶寶正在親餵 ，一時無法出門，只好請住院醫師代為幫忙。由於醫師和護理師穿著一模一樣，確實無 法區分，生產時忙碌又無法先說明，才導致誤解。 嘉義基督教醫院眼科醫師謝旻蒼在臉書上分享這篇文章，劈頭便說台灣真的不缺趕走好 醫護的病人，直問這樣的po文，目的是什麼？；知名醫生小劉醫生劉宗瑀也在 臉書發文說希望原po的用意不是要打擊產科士氣，連我外科看了都要拍拍安慰。 http://www.cna.com.tw/news/ahel/2017060350211.aspx CNTsai :轉錄至看板 BabyMother 06/04 12:03",105,"M.1496535738.A.737"
"89","Sun Jun  4 08:59:52 2017","[問卦] 我的中國同學對於恐攻與民主的看法","我在美國念書時，遇過各種中國人 有一種是最頭痛的 他們對台灣充滿好奇 想跟你聊民主自由 但是又想跟你宣揚中國制度的必要及好處 可是畢業後比誰都積極留在美國工作 就好比這位朋友的言論 http://i.imgur.com/kNucZ72.jpg 我看了之後覺得哪裡怪怪的 有沒有邏輯好的版友來擊破一下他的言論 還是說他講的是對的 極權國家對於恐攻事件相比民主國家 能有更好的預防及處理？ 八卦是他之前很高興公司要幫他辦綠卡... ",104,"M.1496537995.A.20E"
"90","Sun Jun  4 09:27:54 2017","[新聞] 美國35歲下年輕人買房無望，寧花錢體驗人","新聞連結： https://goo.gl/AghLZS 新聞來源：財經新報 新聞內容 房價高漲、物慾高漲，就是薪水不漲的年代，年輕人買房變成一個夢，現在台灣 35 歲以下有房族不是接手長輩的資產，就是靠長輩贊助頭期款，完全靠自己存錢買房的人幾乎成稀有動物。美國年輕人面臨一樣的問題，也期待父母贊助，但贊助金額杯水車薪，自己存不到頭期款，只好把錢拿來體驗人生。 華爾街日報（WSJ）根據房屋租賃平台 Apartment List 的調查報告指出，美國 18~34 歲的年輕人中，將近 7 成的人頭期款準備金不到 1 千美元，約 4 成的人表示每個月幾乎存不到一毛錢，即使是 25~34 歲的人也有將近 4 成每個月存不到錢。 這個調查反應現在美國的房屋市場現狀，雖然 8 成的年輕人仍想買房，但 72% 的人表示最大阻礙就是負擔不起，Apartment List 的研究人員認為現在年輕人不是不想買房，只是延遲買房時間。 報導訪問一名 22 歲的繪圖設計師表示未來 5 年內都沒有買房打算，原因是存款拿去養車修車都快不夠了，他一個月付 975 美元在房租上，約佔月薪的三分之一，但他也認為若工作穩定準備結婚，才會考慮買房。 現在美國年輕人面臨的問題是學貸負擔沉重，加上房租上漲，以及經濟大衰退影響工作穩定度，只好延遲買房時間，而且住在大城市中心有各式各樣時髦的餐廳酒吧娛樂場所，讓年輕人愈來愈存不住錢，也認為存錢沒這麼急迫。 有些年輕人期待從富裕的戰後嬰兒潮父母那邊得到一些贊助，調查發現，25~34 歲族群中有四分之一的人期待接受朋友或家人幫忙，但當中有四分之三的人表示預計只能拿到 1 萬美元。台灣大部分戰後嬰兒潮父母存了錢就拿去囤房，所以多半年輕人從父母方得到的贊助遠不止 1 萬美元，而是一棟價值千萬以上的房產，或是百萬頭期款。 美國年輕人買房還是得靠自己存款，但調查也發現，錢賺愈多的人，存款佔收入比愈低，如年薪不到 2.4 萬的人存錢佔比為 10%，但年收入超過 7.2 萬的人只存 3.5%。25~34 歲的人不到 30% 表示可以在未來 3 年內存到頭期款的一成，只有 15% 的人表示可以存到 10% 以上。 一名 33 歲的資料分析師表示，她先前住在費城時，已經為 20 萬美元的房子存到 10% 的頭期款，但仍沒辦法在社區中買到她中意的房子，現在她搬到加州柏克萊市，這邊的房子動輒 1 百萬美元，買房更是遙遙無期。最後她的結論是，我覺得買房幾乎不可能，還不如花錢旅遊。 華爾街日報的原文 https://goo.gl/jYDD7A 看起來對於年輕的時代來說，在小時候享受到經濟成長的果實，但長大後卻要面對高漲的物價房價 然後還要被老人指責不夠努力，如果認真就會blablabla 看來除了台日韓，美國年輕人也加入這行列了，看來以後會成長的或許是觀光以及航運 畢竟大家無法存錢，不如多出來看看 大家覺得呢？ Sent from JPTT on my Sony D6653. ",111,"M.1496539682.A.5CC"
"91","Sun Jun  4 09:32:52 2017","Fw: [外絮] 今天Dopa直播時不小心播出64跟法輪功影片","LoL 看板 1PCmBSXv ] 作者: mattiswe098 (台中大仁哥) 看板: LoL 標題: [外絮] 今天Dopa直播時不小心播出64跟法輪功影片 時間: Sun Jun 4 02:41:27 2017 今天晚上Dopa在虎牙的直播裡，youtube影片自動出現法輪功跟64天安門的影片，結果負 責操作的翻譯剛好不在，Dopa本人又沒在看直播畫面的，就這樣子在幾十萬人面前播出了 一段時間 後來虎牙就直接關了Dopa直播 http://i.imgur.com/9e7QAcw.jpg http://i.imgur.com/dXXHbuG.jpg 今天中國的百度抗壓吧跟背鍋吧刪了一堆討論的文章 那位Dopa的翻譯已經宣布辭職了幫QQ [按任意鍵繼 續] https://www.ptt.cc/bbs/LoL/M.1496515292.A.879.html 當然不是廣告，是真真實實的影片，但是中國根本打不出這些關鍵字，所以只能用廣告暗 指 翻譯人在韓國啊，她是在韓國工作的中國人，貼吧鄉民就說她不敢回來了，一回來就逮捕 她 不是廣告，是youtube的影片自動播放功能在播完LOL之後自動播放的下一部影片剛好是 64跟法輪功，所以中國鄉民就懷疑她是不是平常就在看這些影片，所以youtube才會自動 推薦這些影片，微博上寫廣告是暗指，因為不能直接打出敏感字，會被和諧",135,"M.1496539973.A.FA9"
"92","Sun Jun  4 09:46:06 2017","[新聞] 談治水 柯P：這國家很奇怪 喜歡花錢做效","中時 談治水 柯P：這國家很奇怪 喜歡花錢做效果差的 2017年06月04日 09:18 張潼 前內政部長李鴻源接受中國時報訪問時提到，這次淹水肇因於短時間強降雨，都市、區域 排水也不良，如果要治水有方，不可以再迷信砸錢的工程手段，而是要與都市設計、 城市設計結合，也就是海綿城市。臺北市長 柯文哲今也表示，李鴻源講的是對的，但 這國家很奇怪，對的事情大家大家不太喜歡做 ，但被問及 蔡英文政府要花錢推前瞻計 畫，柯僅笑而不答。 針對李鴻源提出的意見，柯文哲認為，李是治水專家，講的東西當然有學術基礎，例如 當 年圓山子分洪道，原本設計其實是基隆河加高，要花大概3000多億，後來阿扁時代做，不 到100億，汐止就不淹水了。 柯文哲表示，防洪本來就分3個層次，上游先做水土保持，中游做分洪道、滯洪池，或是 例如 北市現在在推的，人行道等路面都做透水鋪面，讓水先滲透到下面，晴天再蒸發，最 後才是架高提防、設置抽水機。 柯文哲說，以前上游、中游的水土保持等工作不做，卻架高提防、買抽水機，當然花很多 錢效果又不好。所以他認為，李鴻源講的本來就是對的，只是這國家很奇怪，對的事情大 家不太喜歡做，故意做一些比較沒效的、要花錢的，沒辦法。但當媒體追問，蔡英文政府 砸錢做前瞻計畫，其中也包括水環境建設，柯文哲笑回提問記者吼，原來這題目後 面有埋伏 另外，昨天 柯文哲在議會自評此次災害應變與處理有80分 ，但議員卻質疑他在公開場合說 下雨太好了，沒有同理心。柯文哲今表示，下雨太好了是媒體斷章取義，他是講 說趁下雨機會檢視世大運場館，把漏水、積水的地方趕快修理，遇到困難先正面思考，但 如果要特別截那段發言，沒辦法、隨便他。 至於自評80芬，柯文哲也說，這次一開始都在關注文山區，因為防洪計畫剛做好，這次就 過關了，有做有差；內湖區有幾個地方市府也知道了，勘災後回來都要求局處做檢討報告 ，看哪裡要修，出事就改進一遍，會越來越好。 https://goo.gl/LhXes5",696,"M.1496540769.A.122"
